{
  "kind": "chat.chat_link_retrieval_plan",
  "status": "partial",
  "dryRun": true,
  "summary": "Planned 2 Google Chat link candidate reads in dry-run mode.",
  "counts": {
    "candidates": 2,
    "parsed": 0,
    "unknown": 2,
    "plannedRequests": 0,
    "cacheHits": 0,
    "cappedCandidates": 0,
    "cappedPlainTextUrls": 0,
    "cappedPlainTextScanChars": 0,
    "cappedOversizedUrls": 0,
    "cappedOccurrences": 0,
    "cappedTraversalNodes": 0,
    "cappedLinkScanItems": 0
  },
  "truncation": {
    "status": "complete",
    "maxChatLinks": 200,
    "maxPlainTextUrls": 200,
    "maxTraversalDepth": 256,
    "maxTraversalNodes": 5000,
    "maxLinkScanItems": 5000,
    "maxPlainTextScanChars": 65536,
    "maxUrlLength": 2048,
    "maxOccurrencesPerCandidate": 50,
    "candidatesVisited": 2,
    "plainTextUrlsScanned": 0,
    "plainTextCharsScanned": 0,
    "traversalNodesVisited": 1,
    "linkScanItemsVisited": 2,
    "cappedCandidates": 0,
    "cappedPlainTextUrls": 0,
    "cappedPlainTextScanChars": 0,
    "cappedOversizedUrls": 0,
    "cappedOccurrences": 0,
    "cappedTraversalNodes": 0,
    "cappedLinkScanItems": 0
  },
  "candidates": [
    {
      "kind": "chat_link",
      "candidateId": "chat-link-1",
      "source": "chat_space_link_data",
      "originalUrl": "https://chat.google.com/room/AAA/thread-1",
      "title": "Unsafe structured thread",
      "parseStatus": "invalid",
      "confidence": "unknown",
      "scope": "unknown",
      "space": null,
      "thread": null,
      "message": null,
      "resourceName": null,
      "urlShape": "invalid_chat_space_link_data",
      "context": {
        "messageName": null,
        "relationship": "input",
        "path": [
          "input"
        ]
      },
      "warnings": [
        "chatSpaceLinkData.thread was not a canonical spaces/{space}/threads/{thread} resource."
      ],
      "cache": {
        "status": "unavailable",
        "strategy": "resource_last_update_time",
        "key": null,
        "resourceName": null,
        "lastUpdateTime": null,
        "revalidateWith": null
      }
    },
    {
      "kind": "chat_link",
      "candidateId": "chat-link-2",
      "source": "chat_space_link_data",
      "originalUrl": "https://chat.google.com/room/BBB",
      "title": "Unsafe structured message",
      "parseStatus": "invalid",
      "confidence": "unknown",
      "scope": "unknown",
      "space": null,
      "thread": null,
      "message": null,
      "resourceName": null,
      "urlShape": "invalid_chat_space_link_data",
      "context": {
        "messageName": null,
        "relationship": "input",
        "path": [
          "input"
        ]
      },
      "warnings": [
        "chatSpaceLinkData.message was not a canonical spaces/{space}/messages/{message} resource."
      ],
      "cache": {
        "status": "unavailable",
        "strategy": "resource_last_update_time",
        "key": null,
        "resourceName": null,
        "lastUpdateTime": null,
        "revalidateWith": null
      }
    }
  ],
  "requests": [],
  "capability": {
    "ok": true,
    "authMode": "user",
    "requiredScopes": [],
    "requiresAdminApproval": false,
    "reasons": []
  },
  "safety": {
    "liveAllowed": false,
    "notes": [
      "Dry run only; no Google Chat API call was executed."
    ]
  },
  "systemNotes": [
    "System Note: Planned 2 linked Google Chat context reads in dry-run mode; no Google Chat API call was executed.",
    "System Note: Chat link cache keys use resource name plus lastUpdateTime when available so edited messages invalidate cached context."
  ],
  "warnings": [
    "chat-link-1: chatSpaceLinkData.thread was not a canonical spaces/{space}/threads/{thread} resource.",
    "chat-link-2: chatSpaceLinkData.message was not a canonical spaces/{space}/messages/{message} resource."
  ]
}
