{
  "kind": "chat.chat_link_retrieval_plan",
  "status": "partial",
  "dryRun": true,
  "summary": "Planned 4 Google Chat link candidate reads; 1 cache hit can be reused after metadata revalidation.",
  "counts": {
    "candidates": 4,
    "parsed": 3,
    "unknown": 1,
    "plannedRequests": 5,
    "cacheHits": 1,
    "cappedCandidates": 0,
    "cappedPlainTextUrls": 0,
    "cappedPlainTextScanChars": 0,
    "cappedOversizedUrls": 0,
    "cappedOccurrences": 0,
    "cappedTraversalNodes": 0,
    "cappedLinkScanItems": 0
  },
  "truncation": {
    "status": "complete",
    "maxChatLinks": 200,
    "maxPlainTextUrls": 200,
    "maxTraversalDepth": 256,
    "maxTraversalNodes": 5000,
    "maxLinkScanItems": 5000,
    "maxPlainTextScanChars": 65536,
    "maxUrlLength": 2048,
    "maxOccurrencesPerCandidate": 50,
    "candidatesVisited": 4,
    "plainTextUrlsScanned": 0,
    "plainTextCharsScanned": 0,
    "traversalNodesVisited": 1,
    "linkScanItemsVisited": 4,
    "cappedCandidates": 0,
    "cappedPlainTextUrls": 0,
    "cappedPlainTextScanChars": 0,
    "cappedOversizedUrls": 0,
    "cappedOccurrences": 0,
    "cappedTraversalNodes": 0,
    "cappedLinkScanItems": 0
  },
  "candidates": [
    {
      "kind": "chat_link",
      "candidateId": "chat-link-1",
      "source": "chat_space_link_data",
      "originalUrl": "https://chat.google.com/u/0/app/chat/AAA",
      "title": "Message",
      "parseStatus": "parsed",
      "confidence": "high",
      "scope": "message",
      "space": "spaces/AAA",
      "thread": null,
      "message": "spaces/AAA/messages/msg-1",
      "resourceName": "spaces/AAA/messages/msg-1",
      "urlShape": "chat_space_link_data",
      "context": {
        "messageName": "spaces/AAA/messages/source",
        "relationship": "self",
        "path": [
          "self:spaces/AAA/messages/source"
        ],
        "sender": {
          "displayName": "Ada Lovelace",
          "email": "ada@example.com",
          "resourceName": "users/ada",
          "type": "HUMAN",
          "accessState": "available",
          "ambiguityState": "unambiguous"
        },
        "createdAt": "2026-07-05T15:00:00Z",
        "updatedAt": "2026-07-05T15:05:00Z",
        "deletedAt": null,
        "accessState": null
      },
      "warnings": [],
      "cache": {
        "status": "hit",
        "strategy": "resource_last_update_time",
        "key": "chat-link:cached-message",
        "resourceName": "spaces/AAA/messages/msg-1",
        "lastUpdateTime": "2026-07-05T15:10:00Z",
        "revalidateWith": "spaces.messages.get"
      }
    },
    {
      "kind": "chat_link",
      "candidateId": "chat-link-2",
      "source": "plain_url",
      "originalUrl": "https://chat.google.com/room/AAA/thread-1",
      "title": null,
      "parseStatus": "parsed",
      "confidence": "low",
      "scope": "thread",
      "space": "spaces/AAA",
      "thread": "spaces/AAA/threads/thread-1",
      "message": null,
      "resourceName": "spaces/AAA/threads/thread-1",
      "urlShape": "chat_room_thread",
      "context": {
        "messageName": "spaces/AAA/messages/source",
        "relationship": "self",
        "path": [
          "self:spaces/AAA/messages/source"
        ],
        "sender": {
          "displayName": "Ada Lovelace",
          "email": "ada@example.com",
          "resourceName": "users/ada",
          "type": "HUMAN",
          "accessState": "available",
          "ambiguityState": "unambiguous"
        },
        "createdAt": "2026-07-05T15:00:00Z",
        "updatedAt": "2026-07-05T15:05:00Z",
        "deletedAt": null,
        "accessState": null
      },
      "warnings": [
        "Thread URL shape is empirical; verify with live corpus before treating as a stable Google contract."
      ],
      "cache": {
        "status": "metadata_required",
        "strategy": "resource_last_update_time",
        "key": null,
        "resourceName": "spaces/AAA/threads/thread-1",
        "lastUpdateTime": null,
        "revalidateWith": "spaces.messages.list"
      }
    },
    {
      "kind": "chat_link",
      "candidateId": "chat-link-3",
      "source": "plain_url",
      "originalUrl": "https://chat.google.com/u/2/app/chat/BBB",
      "title": null,
      "parseStatus": "parsed",
      "confidence": "medium",
      "scope": "space",
      "space": "spaces/BBB",
      "thread": null,
      "message": null,
      "resourceName": "spaces/BBB",
      "urlShape": "chat_app_space",
      "context": {
        "messageName": "spaces/AAA/messages/source",
        "relationship": "self",
        "path": [
          "self:spaces/AAA/messages/source"
        ],
        "sender": {
          "displayName": "Ada Lovelace",
          "email": "ada@example.com",
          "resourceName": "users/ada",
          "type": "HUMAN",
          "accessState": "available",
          "ambiguityState": "unambiguous"
        },
        "createdAt": "2026-07-05T15:00:00Z",
        "updatedAt": "2026-07-05T15:05:00Z",
        "deletedAt": null,
        "accessState": null
      },
      "warnings": [],
      "cache": {
        "status": "metadata_required",
        "strategy": "resource_last_update_time",
        "key": null,
        "resourceName": "spaces/BBB",
        "lastUpdateTime": null,
        "revalidateWith": "spaces.messages.list"
      }
    },
    {
      "kind": "chat_link",
      "candidateId": "chat-link-4",
      "source": "plain_url",
      "originalUrl": "https://chat.google.com/u/2/app/chat/BBB/BBB/thread-9",
      "title": null,
      "parseStatus": "unknown",
      "confidence": "unknown",
      "scope": "unknown",
      "space": null,
      "thread": null,
      "message": null,
      "resourceName": null,
      "urlShape": "unknown_chat_url",
      "context": {
        "messageName": "spaces/AAA/messages/source",
        "relationship": "self",
        "path": [
          "self:spaces/AAA/messages/source"
        ],
        "sender": {
          "displayName": "Ada Lovelace",
          "email": "ada@example.com",
          "resourceName": "users/ada",
          "type": "HUMAN",
          "accessState": "available",
          "ambiguityState": "unambiguous"
        },
        "createdAt": "2026-07-05T15:00:00Z",
        "updatedAt": "2026-07-05T15:05:00Z",
        "deletedAt": null,
        "accessState": null
      },
      "warnings": [
        "Chat URL shape is not recognized; retained for corpus collection but no API request will be planned."
      ],
      "cache": {
        "status": "unavailable",
        "strategy": "resource_last_update_time",
        "key": null,
        "resourceName": null,
        "lastUpdateTime": null,
        "revalidateWith": null
      }
    }
  ],
  "requests": [
    {
      "candidateId": "chat-link-1",
      "resource": "spaces.messages.get",
      "method": "GET",
      "path": "/v1/spaces/AAA/messages/msg-1",
      "query": {
        "fields": "name,lastUpdateTime,thread.name"
      },
      "body": null,
      "purpose": "read_message_or_revalidate_cache",
      "candidateIds": [
        "chat-link-1"
      ]
    },
    {
      "candidateId": "chat-link-1",
      "resource": "spaces.get",
      "method": "GET",
      "path": "/v1/spaces/AAA",
      "query": {},
      "body": null,
      "purpose": "read_space_breadcrumb",
      "candidateIds": [
        "chat-link-1",
        "chat-link-2"
      ]
    },
    {
      "candidateId": "chat-link-2",
      "resource": "spaces.messages.list",
      "method": "GET",
      "path": "/v1/spaces/AAA/messages",
      "query": {
        "pageSize": 12,
        "filter": "thread.name = \"spaces/AAA/threads/thread-1\"",
        "orderBy": "createTime asc"
      },
      "body": null,
      "purpose": "read_thread_context",
      "candidateIds": [
        "chat-link-2"
      ]
    },
    {
      "candidateId": "chat-link-3",
      "resource": "spaces.get",
      "method": "GET",
      "path": "/v1/spaces/BBB",
      "query": {},
      "body": null,
      "purpose": "read_space_breadcrumb",
      "candidateIds": [
        "chat-link-3"
      ]
    },
    {
      "candidateId": "chat-link-3",
      "resource": "spaces.messages.list",
      "method": "GET",
      "path": "/v1/spaces/BBB/messages",
      "query": {
        "pageSize": 5,
        "orderBy": "createTime desc"
      },
      "body": null,
      "purpose": "read_space_context",
      "candidateIds": [
        "chat-link-3"
      ]
    }
  ],
  "capability": {
    "ok": true,
    "authMode": "user",
    "requiredScopes": [
      "https://www.googleapis.com/auth/chat.messages.readonly",
      "https://www.googleapis.com/auth/chat.spaces.readonly"
    ],
    "requiresAdminApproval": false,
    "reasons": []
  },
  "safety": {
    "liveAllowed": false,
    "notes": [
      "Dry run only; no Google Chat API call was executed."
    ]
  },
  "systemNotes": [
    "System Note: Planned 4 linked Google Chat context reads in dry-run mode; no Google Chat API call was executed.",
    "System Note: Chat link cache keys use resource name plus lastUpdateTime when available so edited messages invalidate cached context."
  ],
  "warnings": [
    "chat-link-2: Thread URL shape is empirical; verify with live corpus before treating as a stable Google contract.",
    "chat-link-4: Chat URL shape is not recognized; retained for corpus collection but no API request will be planned."
  ]
}
