{
  "kind": "chat.chat_link_retrieval_plan",
  "status": "blocked",
  "dryRun": true,
  "summary": "Chat link retrieval planning is disabled by option.",
  "counts": {
    "candidates": 0,
    "parsed": 0,
    "unknown": 0,
    "plannedRequests": 0,
    "cacheHits": 0,
    "cappedCandidates": 0,
    "cappedPlainTextUrls": 0,
    "cappedPlainTextScanChars": 0,
    "cappedOversizedUrls": 0,
    "cappedOccurrences": 0,
    "cappedTraversalNodes": 0,
    "cappedLinkScanItems": 0
  },
  "truncation": {
    "status": "complete",
    "maxChatLinks": 200,
    "maxPlainTextUrls": 200,
    "maxTraversalDepth": 256,
    "maxTraversalNodes": 5000,
    "maxLinkScanItems": 5000,
    "maxPlainTextScanChars": 65536,
    "maxUrlLength": 2048,
    "maxOccurrencesPerCandidate": 50,
    "candidatesVisited": 0,
    "plainTextUrlsScanned": 0,
    "plainTextCharsScanned": 0,
    "traversalNodesVisited": 0,
    "linkScanItemsVisited": 0,
    "cappedCandidates": 0,
    "cappedPlainTextUrls": 0,
    "cappedPlainTextScanChars": 0,
    "cappedOversizedUrls": 0,
    "cappedOccurrences": 0,
    "cappedTraversalNodes": 0,
    "cappedLinkScanItems": 0
  },
  "candidates": [],
  "requests": [],
  "capability": {
    "ok": true,
    "authMode": "user",
    "requiredScopes": [],
    "requiresAdminApproval": false,
    "reasons": []
  },
  "safety": {
    "liveAllowed": false,
    "notes": [
      "Dry run only; no Google Chat API call was executed."
    ]
  },
  "systemNotes": [
    "System Note: Planned 0 linked Google Chat context reads in dry-run mode; no Google Chat API call was executed.",
    "System Note: Chat link cache keys use resource name plus lastUpdateTime when available so edited messages invalidate cached context.",
    "System Note: Chat link retrieval planning is disabled by option."
  ],
  "warnings": []
}
